{
  "contract_version": "1.20.0-v1beta",
  "run_id": "run-fixture-v1beta",
  "experience": "professional",
  "track": "closed_sequential",
  "phase": "deliberate",
  "status": "running",
  "blind_id": "pro-sandbox-001",
  "opening": "Opening note only.",
  "actions": [],
  "observations": [],
  "differential": [],
  "budget_units": 40,
  "spent_units": 0,
  "max_rounds": 12,
  "rounds": 0,
  "diagnosis": "",
  "score": null,
  "error": null,
  "replay": false,
  "scoring_eligible": true,
  "status_public": "experimental / research and education only / not clinically validated",
  "locale": "en"
}
